author,title,section,text,notes
C. Julius Caesar,Gallic War,"book 1, chapter 3","3. Induced by these considerations, and influenced by the authority of Orgetorix, they determined to provide such things as were necessary for their expedition-to buy up as great a number as possible of beasts of burden and wagons-to make their sowings as large as possible, so that on their march plenty of corn might be in store-and to establish peace and friendship with the neighboring states. They reckoned that a term of two years would be sufficient for them to execute their designs; they fix by decree their departure for the third year. Orgetorix is chosen to complete these arrangements. He took upon himself the office of embassador to the states: on this journey he persuades Casticus, the son of Catamantaledes (one of the Sequani, whose father had possessed the sovereignty among the people for many years, and had been styled friend by the senate of the Roman people), to seize upon the sovereignty in his own state, which his father had held before him, and he likewise persuades Dumnorix, an Aeduan, the brother of Divitiacus, who at that time possessed the chief authority in the state, and was exceedingly beloved by the people, to attempt the same, and gives him his daughter in marriage. He proves to them that to accomplish their attempts was a thing very easy to be done, because he himself would obtain the government of his own state; that there was no doubt that the Helvetii were the most powerful of the whole of Gaul; he assures them that he will, with his own forces and his own army, acquire the sovereignty for them. Incited by this speech, they give a pledge and oath to one another, and hope that, when they have seized the sovereignty, they will, by means of the three most powerful and valiant nations, be enabled to obtain possession of the whole of Gaul.",
C. Julius Caesar,Commentaries on the Civil War,"CAESAR'S COMMENTARIES OF THE CIVIL WAR., chapter 2","This speech of Scipio, as the senate was held in the city, and Pompey resided in the suburbs, was considered as coming from Pompey's own mouth. Some were for following milder counsels, of which number was M. Marcellus, who gave it as his opinion: That it was not proper to enter upon the present deliberation, till troops were raised over all Italy , and an army got ready, under whose protection the senate might proceed with freedom and safety in their debates. Callidius was for sending Pompey to his government, to take away all occasion of discord; because Caesar had reason to fear, as two of his legions had been taken from him, that Pompey retained them in the neighbourhood of Rome , with a view to employ them against him. M. Rufus nearly agreed with Callidius. But they were all severely reprimanded by the consul Lentulus, who expressly refused to put Callidius's motion to the vote. Marcellus, awed by the consul's reprimand, retracted what he had said. Thus the clamours of Lentulus, the dread of an army at the gates of Rome , and the menaces of Pompey's friends, forced the greater part of the senate, though with the utmost reluctance and dislike, into a compliance with Scipio's motion: That Caesar should be ordered to disband his army before a certain day then fixed; and that in case of disobedience, he should be declared an enemy to the republic. M. Antonius and Q. Cassius, tribunes of the people, opposed their negative to this decree. Immediately a debate arose, upon the validity of their interposition. Many severe speeches were made against them; and the more warm and passionate any one appeared, the more was he applauded by Caesar's enemies.",
Diana Buitron-Oliver,Douris,Early Middle or Transitional Period,"Early Middle or Transitional Period In the next period, the workshop collaboration with Euphronios appears to have ended. Douris is his own potter in one documented instance in this period, the signed kantharos in Brussels ( Brussels A 718 , ; ). Douris also collaborated with the potter Kleophrades, and he began his long association with the potter Python. Chairestratos is still the favorite kalos-name but there are others, among them Panaitios, which is found on many cups by Onesimos as well. Douris' figures have now become more naturalistic, they move easily and stand gracefully. His talent as a master of composition and his ability as a subtle story-teller become apparent. In this period Douris experiments with two different approaches to vase decoration, one a rich style, characterized by more crowded compositions, elaborately patterned drapery, complex, often unusual, ornamental borders, unusual schemes of decoration such as zoned cups, and full use of linear detail juxtaposed with dilute and regular strength glaze. Douris used the rich style mainly for mythological subjects. In the bare style Douris focused on athletic and courting scenes which called for less crowded compositions and simple ornamental schemes. In these cups Douris could experiment with drawing the male body in a variety of poses.",
Diana Buitron-Oliver,Attic Vase Painting in New England Collections,"Bowdoin
                        1913.25.1-3","Bowdoin 1913.25.1-3 THREE FRAGMENTS OF A TYRRHENIAN AMPHORA Lent by the Bowdoin College Museum of Art; gift of E. P. Warren (1913.25.1 - 3) 1. Height: 4 3/4 in. (12 cm.); Width: 8 1/4 in. (21 cm.) .2 Height: 5 1/2 in. (14 cm.); Width: 7 1/4 in. (18.5 cm.) .3 Height: 5 1/8 in. (13 cm.); Width: 4 3/4 in. (12 cm.) All three fragments broken and repaired; missing pieces restored and painted on .2 and .3; evidence of misfiring on .1. From Cervetri. Part of the shoulder on both sides and part of the belly on one side preserved. Shoulder: on both sides, a fight. Fragment .1: a group of three warriors and a horseman. Two warriors, attacking a third between them, are nude save for greaves (shin guards), helmets, baldric, and scabbard. The warrior on the left holds his shield with his right arm and his javelin with his left, a reversal of the usual hoplite position. The decorated armband (porpax) and leather handle (antilabe) of his shield are thus evident. The warrior on the right holds his shield, properly, on his left arm and attacks with javelin in his right hand. He wears a Chalcidian helmet; the other two helmets are Corinthian. The warrior in the center, dressed in a short tunic (chitoniskos) with baldric and scabbard visible, holds out an empty right hand, and his shield is on the ground. On the far right a horseman approaches. Fragment .2: three warriors. A warrior wearing corslet and greaves, carrying a shield (device: rosette), attacks a warrior of whom only one leg is preserved. In the center a warrior dressed in greaves and Corinthian helmet, sword swinging behind him, and javelin in hand, grasps the crest of a warrior who tries to run away. Since he holds his shield with his right arm, the inside is again visible. Meaningless inscriptions. Fragment .3: horsemen. This fragment preserves a piece of the narrower register below the shoulder scene; the knee of a fallen warrior in the upper frieze is visible. The subsidiary band is here decorated with galloping horsemen and a meaningless inscription. Above and below the shoulder scene are double borders of ivy leaves, alternately red and black. Red: pieces of the armor, e. g. helmet, shield, corslet; parts of the horse's anatomy, e.g. breast, mane. Attributed to the Tyrrhenian Group [Beazley] ca. 575 - 550 B. C. Tyrrhenian vases have been found almost exclusively in Etruria, and although they were at first mistakenly associated with Corinth, their Attic character has been clearly demonstrated by Thiersch ( Thiersch 1899 ). These vases were made in Attica for the Etruscan market. Their characteristics have been redefined by D. von Bothmer ( AJA 48 [1944] 161 ff ). The production of Tyrrhenian vases is limited to the second quarter of the sixth century. The shape is generally an ovoid neck-amphora with echinus foot. The decorative formula consists of a narrative shoulder frieze with subsidiary bands of animals or secondary narrative friezes below; at the bottom are rays. D. von Bothmer has observed (orally) that this vase is unusual in its use of ivy borders above and below the shoulder scenes, as well as the subsidiary narrative frieze on the belly (cf Berlin F 1712 ; ABV, 96, no. 12 ). The style is lively though frequently rough and careless, and the inscriptions do not usually make sense as in this case. Bibliography ABV, 100, no. 71 ; Herbert 1964, 56-57, no. 142.",
Boethius,Consolatio Philosophiae,,"Prosa 1 A mysterious figure, female but more than human, appears at B.'s side and puts to flight the poetic muses. stili officio : with the help of a pen. astitisse : perfect infinitive (< a ( d ) sto ): the woman was already there when B. noticed her. verticem : < vertex , topmost point, thus: head. reverendi vultus : genitive of description. oculis ardentibus et . . . perspicacibus : ablative of description. communem : take with hominum, common to men. quamvis : although, with subjunctive. foret = esset ut . . . crederetur : subjunctive of result. statura discretionis ambiguae : with stature of uncertain measure. quidem . . . vero : on the one hand . . . but on the other, a common usage in B. summi verticis cacumine : with the very top of her head. quae : connecting relative, i.e., relative pronoun in place of demonstrative + et : and she. extulisset : subjunctive of repeated action, with cum ( whenever ). intuitum : gaze, view. filis : ablative plural, threads. uti = ut ( as ). post : adverb. eadem prodente : ablative absolute ( eadem = B.'s visitor). fumosas imagines : The reference seems to be to the wax masks of deceased ancestors which hung in the atrium of a Roman house and gathered soot from the hearth fire between funeral processions, when they were worn by mourners in a masquerade of reincarnation. solet : sc. obducere . Π . . . Θ : for πρᾶχις (practice) and θεορία (theory). To the ancients theory (full contemplative understanding: what the woman now offers) both followed and surpassed practice (merely mechanical competence: concerns of the political domain in which B. was well-versed); thus π appears at the lower hem of the garment, θ at the neckline, with steps leading from the lower to the higher. Graecum : modifies π (taken as neuter). supremo : sc. margine . vero : always used post-positively in its clause; best translated but. elementum : here, letter [of the alphabet]. esset : subjunctive in relative clause of purpose. manus : nominative plural. scenicas : of the stage, used pejoratively, as usual. foverent . . . alerent : subjunctive in relative clause of characteristic. foverent : take care of. verum : the conjunction, but. infructuosis affectuum spinis : with the sterile thorns of [that come from] the emotions. fructibus : ablative with uberem: rich in fruit. assuefaciunt : accustom (transitive). si quem : if anyone ; the indefinite pronoun quis is commonly used after si , nisi , ne , or num . vulgo : adverb. solitum : sc. est . vobis : i.e., Camenis . ferendum : to be borne, tolerated ; sc. esse mihi . nihil : adverbial accusative, not at all. quippe : explanatory particle, for, since. eo : antecedent is quem profanum . hunc vero . . . innutritum : ellipsis of main verb effectively expresses indignation. Eleaticis et Academicis studiis : the teachings of Parmenides of Elea (d. shortly after 450 B.C.), Plato (founder of the Academy at Athens ; d. 347 B.C.) and their disciples. Sirenes : in mythology, birds with the faces of beautiful girls singing sweetly to lure mariners to shore and death. usque in exitium dulces : pleasant to the point of destruction. meisque . . . Musis : dative of agent with curandum and sanandum . His . . . increpitus : rebuked by these [words]. humi : locative. acies : gaze, sight. caligaret . . . possem : subjunctives in relative causal clauses (not quite parallel). dinoscere = dignoscere , recognize, distinguish. esset : subjunctive in indirect question. visuque . . . defixo : ablative absolute. esset actura : imperfect subjunctive + future participle represents a future in an indirect question. conquesta : < conqueror , bewail, lament bitterly.",
Xenophon,Symposium,"Symposium, chapter 1, section 3","[ 3 ] But on catching sight of a group comprising Socrates , Critobulus, Hermogenes, Antisthenes, and Charmides, Callias bade one of his servants escort Autolycus and the others, and himself going over to Socrates and his companions, said,",
Aeschylus,Agamemnon,,"Chorus I have the power to proclaim the augury of triumph given on their way [105] to princely men—since my age 1 still breathes Persuasion upon me from the gods, the strength of song—how the twin-throned command of the Achaeans, [110] the single-minded captains of Hellas ' youth, with avenging spear and arm against the Teucrian land, was sent off by the inspiring omen appearing to the kings of the ships—kingly birds, [115] one black, one white of tail, near the palace, on the spear-hand 2 , in a conspicuous place, devouring a hare with offspring unborn [120] caught in the last effort to escape. 3 Sing the song of woe, the song of woe, but may the good prevail!","Note: 1  σύμφυτος  αἰών , literally “life that has grown with me,” “time of life,” here “old age,” as the Scholiast takes it; cf. Mrs. Barbauld, “Life. We've been long together.”,Note: 2 The right hand.,Note: 3 The Scholiast, followed by Hermann and some others, takes λαγίναν  γένναν as a periphrasis for λαγωόν , with which βλαβέντα agrees （cp. πᾶσα  γέννα ... δώσων  Eur. Tro.  531 ）. With Hartung's φέρματα , the meaning is “the brood of a hare, the burden of her womb, thwarted of their final course.” λοισθίων  δρόμων , on this interpretation, has been thought to mean “their final course” （towards birth） or even their “future racings.”"
Xenophon,Apology,"Apology of Socrates, section 3","[ 3 ] “ Socrates , ought you not to be giving some thought to what defence you are going to make?” That Socrates had at first replied, “Why, do I not seem to you to have spent my whole life in preparing to defend myself?” Then when he asked, “How so?” he had said, “Because all my life I have been guiltless of wrong-doing; and that I consider the finest preparation for a defence.” Then when Hermogenes again asked,",
Xenophon,On Hunting,", chapter 1","[ 2 ] And he had for pupils in venery and in other noble pursuits—Cephalus, Asclepius, Meilanion, Nestor, Amphiaraus, Peleus, Telamon, Meleager, Theseus, Hippolytus, Palamedes, Odysseus, Menestheus, Diomedes, Castor, Polydeuces, Machaon, Podaleirius, Antilochus, Aeneas, Achilles, of whom each in his time was honoured by gods.",
M. Tullius Cicero,De Officiis: index,,"Gaius Acilius Glabrio (tribune, 197); interpreter, when Carneades, Diogenes, and Critolaus came to Rome; author of History of Rome, 3.115 .",
M. Tullius Cicero,De Officiis,Book I: Moral Goodness,"[ 4 ] I believe, of course, that if Plato had been willing to devote himself to forensic oratory, he could have spoken with the greatest eloquence and power; and that if Demosthenes had continued the studies he pursued with Plato and had wished to expound his views, he could have done so with elegance and brilliancy. I feel the same way about Aristotle and Isocrates, each of whom, engrossed in his own profession, undervalued that of the other. [p. 7] 2. But since I have decided to write you a little 1 now (and a great deal by and by), I wish, if possible, to begin with a matter most suited at once to your years and to my position. Although philosophy offers many problems, both important and useful, that have been fully and carefully discussed by philosophers, those teachings which have been handed down on the subject of moral duties seem to have the widest practical application. For no phase of life, whether public or private, whether in business or in the home, whether one is working on what concerns oneself alone or dealing with another, can be without its moral duty; on the discharge of such duties depends all that is morally right, and on their neglect all that is morally wrong in life.",Note: 1 Statement of subject.
Xenophon,On the Art of Horsemanship,"On the Art of Horsemanship, chapter 1","[ 2 ] In examining his body, we say you must first look at his feet. For, just as a house is bound to be worthless less if the foundations are unsound, however well the upper parts may look, so a war-horse will be quite useless, even though all his other points are good, if he has bad feet; for in that case he will be unable to use any of his good points.",
Xenophon,Ways and Means,"Ways and Means, chapter 1, section 3","[ 3 ] The extreme mildness of the seasons here is shown by the actual products. At any rate, plants that will not even grow in many countries bear fruit here. Not less productive than the land is the sea around the coasts. Notice too that the good things which the gods send in their season all come in earlier here and go out later than elsewhere.",
M. Tullius Cicero,Cato the Elder: on old age,,"[ 4 ] 2. SCIPIO. When conversing with Gaius Laelius here present, I am frequently wont to marvel, Cato, both at your pre-eminent, nay, faultless, wisdom in matters generally, and especially at the fact that, so far as I have been able to see, old age is never burdensome to you, though it is so vexatious to most old men that they declare it to be a load heavier than Aetna. CATO. I think, my friends, that you marvel at a thing really far from difficult. For to those who have not the means within themselves of a virtuous and happy life every age is burdensome; and, on the other hand, to those who seek all good from themselves nothing can seem evil that the laws of nature inevitably impose. To this class old age especially belongs, which all men wish to attain and yet reproach when attained; such is the inconsistency and perversity of Folly! They say that it stole upon them faster than they had expected. In the first place, who has forced them to form a mistaken judgement? For how much more rapidly does old age steal upon youth than youth upon childhood? And again, how much less burdensome would old age be to them if they were in their eight hundredth rather than in their eightieth year? In fact, no lapse of time, however long, once it had slipped away, could solace or soothe a foolish old age.",
