author,title,section,text,notes
Celsus,De Medicina,Book I,"1 A man in health, who is both vigorous and his own master, should be under no obligatory rules, and have no need, either for a medical attendant, or for a rubber and anointer. His kind of life should afford him variety; he should be now in the country, now in town, and more often about the farm; he should sail, hunt, rest sometimes, but more often take exercise; for whilst inaction weakens the body, work strengthens it; the former brings on premature old age, the latter prolongs youth. It is well also at times to go to the bath, at times to make use of cold waters; to undergo sometimes inunction, sometimes to neglect that same; to avoid no kind of food in common use; to attend at times a banquet, at times to hold aloof; to eat more than sufficient at one time, at another no more; to take food twice rather than once a day, and always as much as one wants provided one digests it. But whilst exercise and food of this sort are necessities, those of the athletes are redundant; for in the one class any break in the routine of exercise, owing to necessities of civil life, affects the body injuriously, and in the other, bodies thus fed up in their fashion age very quickly and become infirm. Concubitus indeed is neither to be desired overmuch, nor overmuch to be feared; seldom used it [p. 45] braces the body, used frequently it relaxes. Since, however, nature and not number should be the standard of frequency, regard being had to age and constitution, concubitus can be recognized as harmless when followed neither by languor nor by pain. The use is worse in the day-time, and safer by night; but care should be taken that by day it be not immediately followed by a meal, and at night not immediately followed by work and watching. Such are the precautions to be observed by the strong, and they should take care that whilst in health their defences against ill-health are not used up.",
C. Valerius Catullus,Carmina,,"Sparrow, darling of my girl, with which she plays, which she presses to her bosom, to whom she gives her fingertip, arousing sharp bites as he seeks after it, when gleaming with desire of me she jests a light joke of it, so that, I think, it is a solace for her pain when the heavy burning is at rest. Could I but play with you just as she does and lighten the sad cares of mind. ... This was as pleasing to me as the golden apple was to the fleet footed girl, which unloosed her girdle long-time fastened.",
C. Valerius Catullus,Carmina,,"LESBIA'S SPARROW Sparrow! my pet's delicious joy, Wherewith in bosom nurst to toy She loves, and gives her finger-tip For sharp-nib'd greeding neb to nip, Were she who my desire withstood To seek some pet of merry mood, As crumb o' comfort for her grief, Methinks her burning lowe's relief: Could I, as plays she, play with thee, That mind might win from misery free! ... To me t'were grateful (as they say), Gold codling was to fleet-foot May, Whose long-bound zone it loosed for aye.",
C. Julius Caesar,Gallic War,book 1,"2. Among the Helvetii, Orgetorix was by far the most distinguished and wealthy. He, when Marcus Messala and Marcus Piso were consuls [61 B.C.], incited by lust of sovereignty, formed a conspiracy among the nobility, and persuaded the people to go forth from their territories with all their possessions, [saying] that it would be very easy, since they excelled all in valor, to acquire the supremacy of the whole of Gaul. To this he the more easily persuaded them, because the Helvetii, are confined on every side by the nature of their situation; on one side by the Rhine , a very broad and deep river, which separates the Helvetian territory from the Germans; on a second side by the Jura , a very high mountain, which is [situated] between the Sequani and the Helvetii; on a third by the Lake of Geneva, and by the river Rhone, which separates our Province from the Helvetii. From these circumstances it resulted, that they could range less widely, and could less easily make war upon their neighbors; for which reason men fond of war [as they were] were affected with great regret. They thought, that considering the extent of their population, and their renown for warfare and bravery, they had but narrow limits, although they extended in length 240, and in breadth 180 [Roman] miles.",
C. Julius Caesar,Commentaries on the Civil War,CAESAR'S COMMENTARIES OF THE CIVIL WAR.,"Caesar's letter being delivered to the consuls, the tribunes, with much difficulty, procured it a reading in the senate; but could by no means prevail to have his demands brought under deliberation. The consuls proposed to debate upon the state of the republic. Lentulus promised to stand by the senate and the people, if they would deliver their sentiments with freedom and courage; but if they regarded Caesar, and affected to court his friendship, as had been the practice for some time past, he knew, he told them, what he had to do, and was determined to disclaim their authority; not doubting but he would find a ready admittance to the favour and protection of Caesar. Scipio spoke much to the same purpose: That Pompey was firmly bent not to abandon the republic, if he found the senators ready to support him; but if they cooled, or were remiss in their resolves, it would be in vain for them to expect his aid, if they saw cause afterwards to apply for it.",
Diana Buitron-Oliver,Douris,,"Early Period In his Early Period, Douris painted cups made by at least three potters, one of whom, Euphronios, was his teacher. The earliest cups by Douris share the kalos name Chairestratos, and a special border, a trapped meander framing the tondo and serving as a ground-line on the exterior. The subject matter of the early vases focuses on komasts in scenes of revel, or on warriors. A cup in Baltimore ( Baltimore, Hopkins AIA B8 ; ; ) shows two running warriors, the one in front wearing Attic armor and carrying a shield (device: lion head); the second figure, an archer, gorytos on his hip, wears an oriental sleeved and trousered combination with a thin chiton over it, and a soft, peaked hat with ear flaps. These warriors with their limber poses may be compared with the Amazons on the body of Euphronios' volute krater in Arezzo ( Arezzo 1465 ; ; ; ARV2, 15, 6 ). The oriental sleeved and trousered combination featured by Douris, a favorite also with his contemporaries, was popularized by Euphronios. Like Euphronios, Douris was interested in the contrasting effects of different strengths of glazes, but he uses them in an original way to help unify and focus his tondo compositions, juxtaposing areas of dilute or full-strength glaze with the patterns created by the lines of drapery folds. On the cup in Baltimore, the dilute glaze lines of the archer's chiton contrast with the eastern style black striped garment worn underneath. In this scene Douris utilizes a standard compositional type which reflects an actual situation in battle when lightly-armed archers shot from the cover of the hoplite's shield. The round shields echoing the circular frame combined with the diagonal lines of limbs and spears make it an attractive tondo composition. Here, Douris extends the repetition of diagonals created by the juxtaposed limbs by giving the archer a spear paralleling that of the hoplite instead of the bow he should normally carry. Douris exhibits skill and individuality in using groups of lines and gradations of glaze to help centralize and enliven the scene. Euphronios also influenced Douris' fellow cup painters, especially Onesimos, who, like Douris, painted cups made by Euphronios. Beazley suggested that Douris and Onesimos sat side by side in Euphronios' workshop and the two younger painters shared subject matter, ornamental borders, and unusual techniques in their early periods; yet their artistic personalities were different. Comparison of the fight scene on the exterior of a cup by Douris in Boston ( Boston 00.338 ; CB no. 125 ; ; ) with a fight scene by Onesimos also on a cup in Boston ( Boston 01.8021 ; ; ; CB no. 75 ; ARV2, 320, 14 ) makes the difference clear. The figures by Douris seem posed, graceful, and beautifully spaced in the composition. In the scene by Onesimos the figures are larger and closer together, the proportions somewhat clumsy, and it is clear that Onesimos' prime concerns are to convey vigorous action, vivid characterization, and effective narrative. Like Euphronios, Onesimos is willing to sacrifice elegance to naturalistic effect. Douris is not; his primary interest is in creating an elegant, graceful picture, but it might have been at least partly due to Onesimos that he developed his own more subtle method of story-telling. Euphronios and Onesimos remained the major influences on Douris throughout the Early Period.",
Diana Buitron-Oliver,Attic Vase Painting in New England Collections,,"Yale 1913.102 BLACK-FIGURE KOMAST CUP Lent by the Yale University Art Gallery; gift of Rebecca Darlington Stoddard (1913.102) Height: 3 7/16 in. (8.7 cm.); Width: 7 9/16 in. (19.3 cm.) Broken and repaired. Interior: black. Exterior, side A: komos. Three youths dancing; the central youth holds a drinking horn. In the field, rosettes. Side B: a man and two youths dancing; the central youth holds a drinking horn. In the field, rosettes. Under the handles, rosettes with volutes; on the lip, rosettes; at the base, rays. Red: costumes of the dancers, parts of the rosettes and palmettes. Attributed to the KY Painter of the Komast Group [Beazley] ca. 590 - 570 B. C. Komast cups are the earliest Attic kylikes in black-figure. The form of the cup, with short offset lip and short conical foot, is similar to that of Corinthian cups but lightened and improved. The komasts, or padded dancers, are also of Corinthian origin; they are one of the favorite subjects on these cups and give the group its name ( Beazley 1951, 19-21 ). The palmette ornament beneath the handle is also Corinthian, but the thin stems and heavy ends of the volutes are distinctly Attic ( Payne 1931, 198 ). Bibliography Baur 1922, 69, no. 102, pl. III below, fig. 21 right.",
Boethius,Consolatio Philosophiae,", Metrum 1","Metrum 1 Boethius (hereinafter: B.), imprisoned and alone, bewails his condition. Meter: Elegiac couplets. The first line is dactylic hexameter ( - W - W - W - W - u u - - ), the second (called the pentameter) contains two hemiepes ( - W - W - - u u - u u -). In the hexameter caesura is regular after the first syllable of the third foot. No substitutions are allowed in the second hemiepes of the pentameter. qui : (I) who . . . studio florente : ablative absolute; studium here, eagerness, enthusiasm. peregi : < perago , accomplish, complete. lacerae : tattered, bedraggled. scribenda : < scribo ; neuter plural accusative, gerundive of necessity: things that must be written. Camenae : the native Latin name for the Muses. elegi : elegiac verses. ora : < os , oris : mouth, face. Plural for singular is common in poetry. Has : sc. Camenas . pervincere : prevail upon, treated as a verb of hindering governing ne -clause in line 6 AG 558b . comites : predicative, as companions. Gloria : in apposition with the subject of solantur (i.e., Camenae ). felicis : The final syllable is closed, and thus long, before the caesura. maesti : modifies senis (genitive < senex ). inopina : unexpectedly ; adjectives in agreement with the subject often have adverbial force. iussit : governs accusative/infinitive. suam : the reflexive takes its antecedent from the subject of the sentence, hence dolor . intempestivi : out of season, because B. is too young for cani (sc. capilli ), grey hair. maestis : sc. annis ( line 13 ). quam : exclamatory, to be taken closely with surda . . . aure . avertitur : here used in an active sense (comparable to the Greek middle voice: other Hellenisms will occur in B.): [death] turns away [the wretches]. saeva : with adverbial force: cruelly. Dum : In late Latin, dum with subjunctive is interchangeable with circumstantial cum . levibus . . . bonis : ablative, with good things [that are] insubstantial. male : scarcely, not at all, a common way of negating an adjective (here: fida ) in poetry. merserat : pluperfect indicative (< mergo ) instead of perfect, for an unreal statement ( paene has the force of a negative); translate as simple past tense. Cf. LHS 328, Zusätze b, on the rhetorical pluperfect. nubila : cloudy, gloomy, modifies fortuna understood as the subject. me felicem : sc. esse ; accusative/infinitive with iactastis (= iactavistis ). amici : vocative. stabili . . . gradu : ablative of description. Stabilis appears often in the Consolatio, in emphatic positions, to hint at the alternative to the mutability of fortune's world (cf. e.g., 1M4.16 , 2M8.1 , 3M9.3 ).",
Xenophon,Symposium,"Symposium, chapter 1","[ 2 ] It was on the occasion of the horse-races at the greater Panathenaic games; Callias, Hipponicus' son, was enamoured, as it happened, of the boy Autolycus, and in honour of his victory in the pancratium 1 had brought him to see the spectacle. When the racing was over, Callias proceeded on his way to his house in the Peiraeus with Autolycus and the boy's father; Niceratus also was in his company.","Note: 1 The pancratium was a severe athletic contest involving a combination of boxing and wrestling, and requiring on the part of the contestants unusual physique and condition. There were separate events open to men and to boys."
Aeschylus,Agamemnon,lines 83-103,"But, O daughter of Tyndareos, Queen Clytaemestra, [85] what has happened? What news do you have? On what intelligence and convinced by what report do you send about your messengers to command sacrifice? For all the gods our city worships, the gods supreme, the gods below, [90] the gods of the heavens and of the marketplace, have their altars ablaze with offerings. Now here, now there, the flames rise high as heaven, yielding [95] to the soft and guileless persuasion of holy ointment, the sacrificial oil itself brought from the inner chambers of the palace. Of all this declare whatever you can and dare reveal, and be a healer of my uneasy heart. [100] This now at one moment bodes ill, while then again hope, shining with kindly light from the sacrifices, wards off the biting care of the sorrow that gnaws my heart.",
Xenophon,Apology,Apology of Socrates,"[ 2 ] Hermogenes, the son of Hipponicus, however, was a companion of his and has given us reports of such a nature as to show that the sublimity of his speech was appropriate to the resolve he had made. For he stated that on seeing Socrates discussing any and every subject rather than the trial, he had said:",
Xenophon,On Hunting,", chapter 1, section 1","Game and hounds are the invention of gods, of Apollo and Artemis. They bestowed it on Cheiron and honoured him therewith for his righteousness. And he, receiving it, rejoiced in the gift, and used it.",
M. Tullius Cicero,De Officiis: index,Lucius Accius,"Lucius Accius a tragic poet (born 170). His tragedies were mostly imitations from the Greek. Cicero knew him personally; quotes from him, 3.84 , 102 , 106 .",
M. Tullius Cicero,De Officiis,"Book I: Moral Goodness, section 3","[ 3 ] And therefore, my dear Cicero, I cordially recommend 1 you to read carefully not only my orations but also these 2 books of mine on philosophy, which are now about as extensive. For while the orations exhibit a more vigorous style, yet the unimpassioned, restrained style of my philosophical productions is also worth cultivating. Moreover, for the same man to succeed in both departments, both in the forensic style and in that of calm philosophic discussion has not, I observe, been the good fortune of any one of the Greeks so far, unless, perhaps, Demetrius of Phalerum can be reckoned in that number—a clever reasoner, indeed, and, though rather a spiritless orator, he is yet charming, so that you can recognize in him the disciple of Theophrastus. But let others judge how much I have accomplished in each pursuit; I have at least attempted both.","Note: 1 Philosophy and oratory.,Note: 2 Cicero is alluding to his Republic, Tusculan Disputations, Theories of the Supreme Good and Evil, The Nature of the Gods, Academics, Hortensius, his essays on Friendship (Laelius), Old Age (Cato), Fate, Divination, etc. (15 in all)."
Xenophon,On the Art of Horsemanship,"On the Art of Horsemanship, chapter 1, section 1","Inasmuch as we have had a long experience of cavalry, and consequently claim familiarity with the art of horsemanship, we wish to explain to our younger friends what we believe to be the correct method of dealing with horses. True there is already a treatise on horsemanship by Simon, 1 who also dedicated the bronze horse in the Eleusinium at Athens and recorded his own feats in relief on the pedestal. Nevertheless, we shall not erase from our work the conclusions that happen to coincide with his, but shall offer them to our friends with far greater pleasure, in the belief that they are more worthy of acceptance because so expert a horseman held the same opinions as we ourselves: moreover, we shall try to explain all the points that he has omitted. First we will give directions how best to avoid being cheated in buying a horse. For judging an unbroken colt, the only criterion, obviously, is the body, for no clear signs of temper are to be detected in an animal that has not yet had a man on his back.","Note: 1 A considerable fragment of this work survives in a MS. in Emmanuel College, Cambridge . The most recent editions are those of Oder and Ruhl. The “cavalry commander” named Simon referred to in Aristophanes' Knights 242, is just a member of the chorus, but the name probably recalls the author."
Xenophon,Ways and Means,"Ways and Means, chapter 1","[ 2 ] Now as I thought over my ideas, one thing seemed clear at once, that the country is by its nature capable of furnishing an ample revenue. To drive home the truth of this statement I will first describe the natural properties of Attica.",
M. Tullius Cicero,Cato the Elder: on old age,section 3,"[ 3 ] Now on other subjects I have said much and shall often have much to say; this book, which I am sending to you, is on old age. But the entire discourse I have attributed, not to Tithonus, as Aristo of Ceos did, (for there would be too little authority in a myth), but, that I might give it greater weight, I have ascribed it to the venerable Marcus Cato; and I represent Laelius and Scipio, while at his house, expressing wonder that he bears his age so well, and Cato replying to them. If it shall appear that he argues more learnedly than he was accustomed to do in his own books, give the credit to Greek literature, of which, as is well known, he was very studious in his later years. But why need I say more? For from now on the words of Cato himself will completely unfold to you my own views on old age. [p. 13]",
Celsus,De Medicina,"Book I, chapter 2","2 The weak, however, among whom are a large portion of townspeople, and almost all those fond of letters, need greater precaution, so that care may re-establish what the character of their constitution or of their residence or of their study detracts. Anyone therefore of these who has digested well may with safety rise early; if too little, he must stay in bed, or if he has been obliged to get up early, must go to sleep again; he who has not digested, should lie up altogether, and neither work nor take exercise nor attend to business. He who without heartburn eructates undigested food should drink cold water at intervals and none the less exercise self-control. He should also reside in a house that is light, airy in summer, sunny in winter; avoid the midday sun, the morning and evening chill, also exhalations from rivers and marshes; and he should not often expose himself when the sky is cloudy to a sun that breaks through . . ., lest he should be affected alternately by cold and heat — a thing which excites [p. 47] particularly choked nostrils and running colds. Much more indeed are these things to be watched in unhealthy localities, where they even produce pestilence. He can tell that his body is sound, if his morning urine is whitish, later reddish; the former indicates that digestion is going on, the latter that digestion is complete. On waking one should lie still for a while, then, except in winter time, bathe the face freely with cold water; when the days are long the siesta should be taken before the midday meal, when short, after it. In winter, it is best to rest in bed the whole night long; if there must be study by lamp-light, it should not be immediately after taking food, but after digestion. He who has been engaged in the day, whether in domestic or on public affairs, ought to keep some portion of the day for the care of the body. The primary care in this respect is exercise, which should always precede the taking of food; the exercise should be ampler in the case of one who has laboured less and digested less well. Useful exercises are: reading aloud, drill, handball, running, walking; but this is not by any means most useful on the level, since walking up and down hill varies the movement of the body, unless indeed the body is thoroughly weak; but it is better to walk in the open air than under cover; better, when the head allows of it, in the sun than in the shade; better under the shade of a wall or of trees than under a roof; better a straight than a winding walk. But the exercise ought to come to an end with sweating, or at any rate lassitude, which should be [p. 49] well this side of fatigue; and sometimes less, sometimes more, is to be done. But in these matters, as before, the example of athletes should not be followed, with their fixed rules and immoderate labour. The proper sequel to exercise is: at times an anointing, whether in the sun or before a brazier; at times a bath, which should be in a chamber as lofty, well lighted and spacious as possible. However, neither should be made use of invariably, but one of the two the oftener, in accordance with the constitution. There is need of a short rest afterwards. Coming to food, a surfeit is never of service, excessive abstinence is often unserviceable; if any intemperance is committed, it is safer in drinking than in eating. It is better to begin a meal with savouries, salads and such-like; and after that meat is to be eaten, best either when roasted or boiled. All preserved fruits are unserviceable for two reasons, because more is taken owing to their sweetness, and even what is moderate is still digested with some difficulty. Dessert does no harm to a good stomach, in a weak one it turns sour. Whoever then in this respect has too little strength, had better eat dates, apples and such-like at the beginning of the meal. After many drinkings which have somewhat exceeded the demands of thirst, nothing should be eaten; after a surfeit of food there should be no exertion. Anyone who has had his fill digests the more readily if he concludes the meal with a drink of cold water, then after keeping awake for a time has a sound sleep. When a full meal is taken at [p. 51] midday, after it there should be no exposure to cold, heat or fatigue, which do not harm the body so easily when it is empty as when it is full. When from whatever causes there is prospective want of food, everything laborious should be avoided.",
C. Valerius Catullus,Carmina,poem 3,"O mourn, you Loves and Cupids, and all men of gracious mind. Dead is the sparrow of my girl, sparrow, darling of my girl, which she loved more than her eyes; for it was sweet as honey, and its mistress knew it as well as a girl knows her own mother. Nor did it move from her lap, but hopping round first one side then the other, to its mistress alone it continually chirped. Now it fares along that path of shadows from where nothing may ever return. May evil befall you, savage glooms of Orcus, which swallow up all things of fairness: which have snatched away from me the comely sparrow. O wretched deed! O hapless sparrow! Now on your account my girl's sweet eyes, swollen, redden with tear-drops.",
C. Valerius Catullus,Carmina,ON THE DEATH OF LESBIA'S SPARROW,"ON THE DEATH OF LESBIA'S SPARROW Weep every Venus , and all Cupids wail, And men whose gentler spirits still prevail. Dead is the Sparrow of my girl, the joy, Sparrow, my sweeting's most delicious toy, Whom loved she dearer than her very eyes; For he was honeyed-pet and anywise Knew her, as even she her mother knew; Ne'er from her bosom's harbourage he flew But 'round her hopping here, there, everywhere, Piped he to none but her his lady fair. Now must he wander o'er the darkling way Thither, whence life-return the Fates denay. But ah! beshrew you, evil Shadows low'ring In Orcus ever loveliest things devouring: Who bore so pretty a Sparrow fro' her ta'en. (Oh hapless birdie and Oh deed of bane!) Now by your wanton work my girl appears With turgid eyelids tinted rose by tears.",
