author,title,section,text,notes
Aeschylus,Agamemnon,lines 1-39,"[1] Release from this weary task of mine has been my plea to the gods throughout this long year's watch, in which, lying upon the palace roof of the Atreidae, upon my bent arm, like a dog, I have learned to know well the gathering of the night's stars, those radiant potentates conspicuous in the firmament, [5] bringers of winter and summer to mankind [the constellations, when they rise and set]. So now I am still watching for the signal-flame, the gleaming fire that is to bring news from Troy and [10] tidings of its capture. For thus commands my queen, woman in passionate heart and man in strength of purpose. And whenever I make here my bed, restless and dank with dew and unvisited by dreams—for instead of sleep fear stands ever by my side, [15] so that I cannot close my eyelids fast in sleep—and whenever I care to sing or hum （and thus apply an antidote of song to ward off drowsiness）, then my tears start forth, as I bewail the fortunes of this house of ours, not ordered for the best as in days gone by. [20] But tonight may there come a happy release from my weary task! May the fire with its glad tidings flash through the gloom! The signal fire suddenly flashes out Oh welcome, you blaze in the night, a light as if of day, you harbinger of many a choral dance in Argos in thanksgiving for this glad event! [25] Hallo! Hallo! To Agamemnon's queen I thus cry aloud the signal to rise from her bed, and as quickly as she can to lift up in her palace halls a shout of joy in welcome of this fire, if the city of Ilium [30] truly is taken, as this beacon unmistakably announces. And I will make an overture with a dance upon my own account; for my lord's lucky roll I shall count to my own score, now that this beacon has thrown me triple six. Ah well, may the master of the house come home and may [35] I clasp his welcome hand in mine! For the rest I stay silent; a great ox stands upon my tongue 1 —yet the house itself, could it but speak, might tell a plain enough tale; since, for my part, by my own choice I have words for those who know, and to those who do not know, I've lost my memory. He descends by an inner stairway; attendants kindle fires at the altars placed in front of the palace. Enter the chorus of Argive Elders","Note: 1 A proverbial expression （of uncertain origin） for enforced silence; cf. fr. 176, “A key stands guard upon my tongue.”"
M. Tullius Cicero,De Senectute: introduction,chapter intro,"Introduction to the Cato Maior 1. Cicero as a writer of philosophy In his youth, in preparation for a public career, Cicero devoted himself with ardour and success to the study of philosophy, and, during the whole of an exceptionally busy life, spent all his spare moments in reading and in the society of the learned. As a relaxation from public employment he produced in 55 B.C. his De oratore, in 54 his De republica and in 52 his De legibus. His choice of literature as his chief pursuit was due to political causes. In January 49 B.C., after twelve months as governor of Cilicia, Cicero returned to Italy to find his country in the midst of civil war. Long hesitating which side to embrace, he finally gave his support to Pompey. After the battle of Pharsalus, in August 48, Cicero decided that further resistance to Caesar was useless and, in October, went to Brundisium, remaining there virtually a prisoner until September 47, when Caesar granted him an unconditional pardon. Although treated by the dictator and his friends with great respect, Cicero held proudly aloof from any active participation in a government which he regarded as a tyranny. [p. 3] When, by Caesar's complete dominance of the courts and the Senate, Cicero had been excluded from those activities in which he had spent thirty brilliant and laborious years, he was forced to find some other outlet for his tireless energy of mind and body. Full of grief for the downfall of the Republic, harassed by debt and struggling under an almost intolerable weight of domestic sorrows, he turned to the writing of philosophic books as the surest relief from trouble and as the best means of serving his country. Early in 46 B.C., he withdrew from Rome to the quiet of his country places, and in that year published Paradoxa, Partitiones oratoriae, Orator, De claris oratoribus, and, probably, Hortensius. In February 45 the death of his adored and only daughter drove him into a frenzy of writing in an effort to forget his grief. In an incredibly short time he produced, in the years 45 and 44, Consolatio, De finibus, Tusculanae disputationes, De natura deorum, Cato Maior, De divinatione, De fato, De gloria, De amicitia, Topica, and De officiis. The De officiis, finished in November, closed his literary career. 2. Date of composition In a letter to Atticus written on May 11, 44 B.C. ( Ad Att. xiv. 21), Cicero speaks of the Cato Maior as then already written. In the De divinatione it is referred to as a recent work. It followed the De natura deorum which was not completed until late in August 45. While there can be no certainty as to the exact time of composition the probability is that it was written between [p. 4] December 15, 45 and January 3, 44 B.C. It was not fully revised, however, until July 17, 44 ( Ad Att. xvi. 3). 1 3. Title Cicero once refers to this essay as O Tite, si quid ( Ad Att. xiv. 11), from its initial words; once as De senectute ( De div. ii. 3), and twice as Cato Maior ( Lael. 4; Ad Att. xiv. 21). Its full title is Cato Maior de senectute. 4. Dedication to Atticus The Cato Maior and the Laelius are both dedicated to TITUS POMPONIUS ATTICUS, who was born at Rome in 109 B.C. His friendship with Cicero began in childhood and continued until Cicero's death in 43 B.C. From about 88 to 65 B.C., Atticus lived in Athens, devoting himself to the study of Greek philosophy and literature. He wrote Latin verses, which are highly commended by his biographer Cornelius Nepos, Roman Annales, a genealogical history of Roman families and a history in Greek of Cicero's consulship. He died in 32 B.C., at the age of 77, highly esteemed by the Emperor Augustus Caesar and by the leading Romans of his day. More than 400 letters from Cicero to him are extant to prove the rare intimacy and deep affection existing between these two remarkable men. [p. 5] 5. TIME OF THE DIALOGUE AND ITS INTERLOCUTORS The discussion is supposed to occur in the year 150 B.C., between Cato, then 84, Scipio, then 35, and Laelius, 2 then about 36. MARCUS PORCIUS CATO, who was born at Tusculum in 234 B.C., served under Fabius Maximus as a private soldier in the campaign against Hannibal in Campania in 214, and as a military tribune in the siege of Tarentum in 209. He was elected quaestor in 204, plebeian aedile in 199, praetor in 198, and consul in 195. In 194 he celebrated a triumph for his victories in Spain. In the war against Antiochus he was on the staff of the consul Marcus Acilius Glabrio, and distinguished himself at the Battle of Thermopylae in 191. In 184 he was censor with Flaccus and began his struggles against the lax morals of the day. He degraded seven senators, and exerted all his power to stem the tide of luxury and extravagance. Going as an envoy to Carthage in 157, he returned full of alarm at its prosperity and always thereafter, it is said, concluded every speech with the words ceterum censeo delendam esse Carthaginem. He died in 149. In addition to his ability as a farmer, soldier, statesman and orator, Cato had considerable literary talent. He published 150 speeches, a book of witticisms, a treatise entitled De re rustica, works on legal subjects and a history of Rome from its foundation to the year 150 B.C., entitled Origines. PUBLIUS SCIPIO AFRICANUS MINOR was born about 185 B.C. He was the son by birth of Lucius Aemilius [p. 6] Paulus, and the son by adoption of Publius Cornelius Scipio, son of Africanus the Elder. He was a great student and a patron of Greek and Roman letters, and numbered among his intimate friends Polybius, the Greek historian; Panaetius the Stoic, and the Roman poets Lucullus and Terence. At the age of seventeen he fought under his father Paulus at Pydna, and in 151 B.C. was military tribune in Spain. In 148, though only a candidate for the aedileship, he was elected consul. As consul a second time he destroyed Carthage in 146. Thirteen years later, in his third consulship, he captured Numantia. His death occurred in 129 and was due, it was thought, to violence. Carbo, the popular leader, was suspected of having strangled him in his bed as he slept. According to the evidence of Cicero and Polybius ( Hist. xxxii. 9–16), Scipio was one of the purest and noblest men in history. 6. Greek sources of the Cato Maior Cicero, in the letter of dedication of the Cato Maior, refers to Aristo Cius as the author of a treatise on old age, and he may have drawn upon that author in writing his own treatise. In Chapters 2 and 3 the conversation between Cephalus and Socrates in Plato's Republic is closely followed. Chapters 17 and 22 contain passages from Xenophon's Oeconomicus and Cyropaedia. In the form of the dialogue Cicero adopted the method of Aristotle rather than that of Plato, to avoid the frequent and continuous exchange of question and answer, and to permit one speaker, after a few [p. 7] remarks from the other interlocutors, to give a connected discussion. 7. Manuscripts, editions and translations The best MSS. of the Cato Maior are: P (at Paris), 9th or 10th century; L (at Leyden), 10th century; B (at Munich), 12th century; R (at Zurich), of uncertain date; E (at Berlin), 12th century; S (at Munich), 11th century. The present text is eclectic, following most closely that of J. S. Reid, but with such readings adopted from the editions of Müller, Bennett and others as seemed preferable. The critical notes of Reid and Müller and the interpretative notes of Reid and Bennett have been consulted with great profit in the preparation of the translation. For an extensive bibliography of this essay the reader is referred to the excellent edition of Frank Gardner Moore. Of the many translations consulted the best, in the opinion of the present translator, in their order of merit, are those of Shuckburgh, Edmonds, and A. P. Peabody. My grateful acknowledgements are due to Prof. bechtel of Tulane University, and to Prof. henry Strauss and Dr. J. L. Hancock of the University of Arkansas for a critical reading of the manuscript, and to my friends Mr. Brookes More of Hingham, Mass., and the late Judge Jesse Turner of Van Buren, Ark., for many helpful suggestions and criticisms.","Note: 1 That the reference in this letter is to Cato Maior and not to De gloria is clear from the context; besides, the De gloria had been sent to Atticus six days before ( Ad Att. xvi. 2).,Note: 2 For a sketch of Laelius see Lael. Introd, pp. 104–105."
M. Tullius Cicero,De Officiis: introduction and bibliography,INTRODUCTION,"INTRODUCTION IN the de Officiis we have, save for the latter Philippics, the great orator's last contribution to literature. The last, sad, troubled years of his busy life could not be given to his profession; and he turned his never-resting thoughts to the second love of his student days and n ade Greek philosophy a possibility for Roman readers. The senate had been abolished; the courts had been closed. His occupation was gone; but Cicero could not surrender himself to idleness. In those days of distraction (46–43 B.C.) he produced for publication almost as much as in all his years of active life. The liberators had been able to remove the tyrant, but they could not restore the republic. Cicero's own life was in danger from the fury of mad Antony and he left Rome about the end of March, 44 B.C. He dared not even stop permanently in any one of his various country estates, but, wretched, wandered from one of his villas to another nearly all the summer and autumn through. He would not suffer himself to become a prey to his overwhelming sorrow at the death of the republic and the final crushing of the hopes that had risen with Caesar's downfall, but worked at the highest tension on his philosophical studies. The Romans were not philosophical. In 161 B.C. the senate passed a decree excluding all philosophers [p. xii] and teachers of rhetoric from the city. They had no taste for philosophical speculation, in which the Greeks were the world's masters. They were intensely, narrowly practical. And Cicero was thoroughly Roman. As a student in a Greek university he had had to study philosophy. His mind was broad enough and his soul great enough to give him a joy in following after the mighty masters, Socrates, Plato, Zeno, Cleanthes, Aristotle, Theophrastus, and the rest. But he pursued his study of it, like a Roman, from a “practical” motive—to promote thereby his power as an orator and to augment his success and happiness in life. To him the goal of philosophy was not primarily to know but to do. Its end was to point out the course of conduct that would lead to success and happiness. The only side of philosophy, therefore, that could make much appeal to the Roman mind was ethics; pure science could have little meaning for the practical Roman; metaphysics might supplement ethics and religion, without which true happiness was felt to be impossible. Philosophical study had its place, therefore, and the most important department of philosophy was ethics. The treatise on Moral Duties has the very practical purpose of giving a practical discussion of the basic principles of Moral Duty and practical rules for personal conduct. As a philosopher, if we may so stretch the term as to include him, Cicero avows himself an adherent of the New Academy and a disciple of Carneades. He had tried Epicureanism under Phaedrus and Zeno, Stoicism under Diodotus and Posidonius; but Philo of Larissa converted him to the New Academy. Scepticism declared the attainment of absolute [p. xiii] knowledge impossible. But there is the easily obtainable golden mean of the probable; and that appealed to the practical Roman. It appealed especially to Cicero; and the same indecision that had been his bane in political life naturally led him first to scepticism, then to eclecticism, where his choice is dictated by his bias for the practical and his scepticism itself disappears from view. And while Antiochus, the eclectic Academician of Athens, and Posidonius, the eclectic Stoic of Rhodes, seem to have had the strongest influence upon him, he draws at his own discretion from the founts of Stoics, Peripatetics, and Academicians alike; he has only contempt for the Epicureans, Cynics, and Cyrenaics. But the more he studied and lived, the more of a Stoic in ethics he became. The cap-sheaf of Cicero's ethical studies is the treatise on the Moral Duties. It takes the form of a letter addressed to his son Marcus (see Index), at this time a youth of twenty-one, pursuing his university studies in the Peripatetic school of Cratippus in Athens, and sowing for what promised to be an abundant crop of wild oats. This situation gives force and definiteness to the practical tendencies of the father's ethical teachings. And yet, be it observed, that same father is not without censure for contributing to his son's extravagant and riotous living by giving him an allowance of nearly £870 a year. Our Roman makes no pretensions to originality in philosophic thinking. He is a follower—an expositor—of the Greeks. As the basis of his discussion of the Moral Duties he takes the Stoic Panaetius of Rhodes (see Index), περὶ καθήκοντος , drawing also [p. xiv] from many other sources, but following him more or less closely in Books I and II; Book III is more independent and much inferior. He is usually superficial and not always clear. He translates and paraphrases Greek philosophy, weaving in illustrations from Roman history and suggestions of Roman mould in a form intended to make it, if not popular, at least comprehensible, to the Roman mind. How well he succeeded is evidenced by the comparative receptivity of Roman soil prepared by Stoic doctrine for the teachings of Christianity. Indeed, Anthony Trollope labels our author the “Pagan Christian.” “You would fancy sometimes,” says Petrarch, “it is not a Pagan philosopher but a Christian apostle who is speaking.” No less an authority than Frederick the Great has called our book “the best work on morals that has been or can be written.” Cicero himself looked upon it as his masterpiece. It has its strength and its weakness—its sane common sense and noble patriotism, its self-conceit and partisan politics; it has the master's brilliant style, but it is full of repetitions and rhetorical flourishes, and it fails often in logical order and power; it rings true in its moral tone, but it shows in what haste and distraction it was composed; for it was not written as a contribution to close scientific thinking; it was written as a means of occupation and diversion.",
M. Tullius Cicero,De Officiis: index,Academicians,"Academicians 1. adherents of the New Academy ( q.v. ); their right to teach ethics, 1.6 . attitude toward knowledge, 2.7 . Cicero's philosophy, 2.1 – 8 . 2 . adherents of the Old Academy, 3.20 .",
M. Tullius Cicero,De Officiis,"Book I: Moral Goodness, section 1","1. My dear son Marcus, you have now been studying 1 a full year under Cratippus, and that too in Athens, and you should be fully equipped with the practical precepts and the principles of philosophy; so much at least one might expect from the pre-eminence not only of your teacher but also of the city; the former is able to enrich you with learning, the latter to supply you with models. Nevertheless, just as I for my own improvement have always combined Greek and Latin studies—and I have done this not only in the study of philosophy but also in the practice of oratory—so I recommend that you should do the same, so that you may have equal command of both languages. And it is in this very direction that I have, if I mistake not, rendered a great service to our countrymen, so that not only those who are unacquainted with Greek literature but even the cultured consider that they have gained much both in oratorical power and in mental training.",Note: 1 Introduction: the importance of combining Greek and Latin studies.
